5400_-NONE-_54310318P00029_A00004_-NONE-_0,CONT_AWD_54310318P00029_5400_-NONE-_-NONE-,54310318P00029,A00004,0,,,,,-25925.00,145195.00,14260.00,-25925.00,145195.00,-25925.00,145195.00,Q: Not Designated Nonemergency/Emergency/Disaster/Wildfire Suppression,,,,,2024-08-27,2024,2018-09-24,2019-10-28,2019-10-28 00:00:00,,,054,Federal Labor Relations Authority,5400,Federal Labor Relations Authority,543103,FLRA,054,Federal Labor Relations Authority,5400,Federal Labor Relations Authority,543103,FLRA,054-2018/2018-0100-000;054-2019/2019-0100-000,054-0100,25.2: Other services from non-Federal sources,0001: AUTHORITY,X,NOT APPLICABLE,,,WB7LFWFMLRY3,,KAPAX SOLUTIONS LLC,KAPAX SOLUTIONS LLC,,6KS74,WB7LFWFMLRY3,,KAPAX SOLUTIONS LLC,KAPAX SOLUTIONS LLC,USA,UNITED STATES,44308 NAVAJO DRIVE,,ASHBURN,51107,LOUDOUN,51,VA,VIRGINIA,201475038,VA-10,VA-10,5712390653,8772758299,USA,UNITED STATES,WASHINGTON,11001,DISTRICT OF COLUMBIA,11,DC,DISTRICT OF COLUMBIA,200520058,DC-98,DC-98,AWARD,B,PURCHASE ORDER,,,,,,,J,FIRM FIXED PRICE,BFD CONTRACT SUPPORT,BFD CONTRACT SUPPORT,C,FUNDING ONLY ACTION,,1,OT,OTHER FUNCTIONS,R401,SUPPORT- PROFESSIONAL: PERSONAL CARE (NON-MEDICAL),H,NOT BUNDLED,,,561330,PROFESSIONAL EMPLOYER ORGANIZATIONS (FORMERLY EMPLOYEE LEASING SERVICES),D,ENERGY EFFICIENT,A,U.S. OWNED BUSINESS,,,,,E,NOT REQUIRED,USA,UNITED STATES,C,NOT A MANUFACTURED END PRODUCT,B,PLAN NOT REQUIRED,F,COMPETED UNDER SAP,SP1,SIMPLIFIED ACQUISITION,SBA,SMALL BUSINESS SET ASIDE - TOTAL,NONE,NO PREFERENCE USED,,,,,,,1,A,COMMERCIAL PRODUCTS/SERVICES,f,N,NO,N,NO,X,NOT APPLICABLE,N,NO,,N,NO,X,NOT APPLICABLE,X,NOT APPLICABLE,X,NOT APPLICABLE,X,NOT APPLICABLE,,,,,,,,,,,,,,N,TRANSACTION DOES NOT USE GFE/GFP,,,X,NO,D,NOT CONSOLIDATED,N,NO - SERVICE WHERE PBA IS NOT USED.,,,,,N,NO,X,NOT APPLICABLE,f,f,f,f,f,f,f,t,t,t,f,f,t,f,f,t,f,f,f,SMALL BUSINESS,S,f,f,f,f,f,f,f,f,f,f,f,f,f,f,f,f,f,CORPORATE NOT TAX EXEMPT,t,f,f,f,f,f,f,f,f,f,f,f,f,f,f,f,f,t,f,f,f,f,f,f,f,f,t,f,t,f,f,f,f,f,f,f,f,f,f,f,f,f,f,f,f,t,f,t,f,f,,,,,,,,,,,https://www.usaspending.gov/award/CONT_AWD_54310318P00029_5400_-NONE-_-NONE-/,2024-08-27,2024-08-27
3355_-NONE-_33301124CFC0026_0_-NONE-_0,CONT_AWD_33301124CFC0026_3355_-NONE-_-NONE-,33301124CFC0026,0,0,,,,,25277.80,25277.80,,397435.80,397435.80,1991635.26,1991635.26,,,,,,2024-08-28,2024,2024-08-30,2025-08-31,2029-08-31 00:00:00,,2024-05-12,3302,National Gallery of Art,3355,National Gallery of Art,333011,NGA PROCUREMENT  CONTRACTS,3302,National Gallery of Art,3355,National Gallery of Art,333011,NGA PROCUREMENT  CONTRACTS,,,,,X,NOT APPLICABLE,,,FPM4BZVRSAF1,,METROPOLITAN MEDICAL LLC,METROPOLITAN MEDICAL LLC,,8PJ15,N3STEW2ELD94,,METROPOLITAN MEDICAL LLC,METROPOLITAN MEDICAL LLC,USA,UNITED STATES,123 N GARFIELD ST,,ARLINGTON,51013,ARLINGTON,51,VA,VIRGINIA,222011054,VA-08,VA-08,7037254052,,USA,UNITED STATES,WASHINGTON,11001,DISTRICT OF COLUMBIA,11,DC,DISTRICT OF COLUMBIA,205650001,DC-98,DC-98,AWARD,D,DEFINITIVE CONTRACT,,,,,,,J,FIRM FIXED PRICE,OCCUPATIONAL HEALTH CLINIC SERVICES,OCCUPATIONAL HEALTH CLINIC SERVICES,,,333011-24-RRP-0005,1,OT,OTHER FUNCTIONS,R401,SUPPORT- PROFESSIONAL: PERSONAL CARE (NON-MEDICAL),H,NOT BUNDLED,,,561330,PROFESSIONAL EMPLOYER ORGANIZATIONS (FORMERLY EMPLOYEE LEASING SERVICES),C,NO CLAUSES INCLUDED AND NO SUSTAINABILITY INCLUDED,A,U.S. OWNED BUSINESS,,,,,E,NOT REQUIRED,USA,UNITED STATES,C,NOT A MANUFACTURED END PRODUCT,B,PLAN NOT REQUIRED,A,FULL AND OPEN COMPETITION,NP,NEGOTIATED PROPOSAL/QUOTE,NONE,NO SET ASIDE USED.,NONE,NO PREFERENCE USED,,,,,,,4,A,COMMERCIAL PRODUCTS/SERVICES,f,N,NO,,,N,NO,N,NO,0.00,N,NO,N,NO,Y,YES,N,NO,X,NOT APPLICABLE,,,,,,,,,,N,NO,X,NOT APPLICABLE EXEMPT FROM CAS,Y,TRANSACTION USES GFE/GFP,,,X,NO,D,NOT CONSOLIDATED,N,NO - SERVICE WHERE PBA IS NOT USED.,N,NO,,,N,NO,X,NOT APPLICABLE,f,f,f,f,f,f,f,f,f,f,f,f,t,f,f,t,f,f,f,SMALL BUSINESS,S,f,f,f,f,f,f,f,f,f,f,f,f,f,f,f,f,f,CORPORATE NOT TAX EXEMPT,t,f,f,f,f,f,f,f,f,f,f,f,f,f,f,f,f,t,f,f,f,f,f,f,f,f,t,f,t,f,f,f,f,f,f,f,f,f,f,f,f,f,f,f,f,t,f,f,f,f,,,,,,,,,,,https://www.usaspending.gov/award/CONT_AWD_33301124CFC0026_3355_-NONE-_-NONE-/,2024-08-13,2024-08-28
7529_7529_75N90024F00001_0_75N90021D00032_0,CONT_AWD_75N90024F00001_7529_75N90021D00032_7529,75N90024F00001,0,0,7529,NATIONAL INSTITUTES OF HEALTH,75N90021D00032,0,1538082.00,1538082.00,,1538082.00,1538082.00,1538082.00,1538082.00,Q: Not Designated Nonemergency/Emergency/Disaster/Wildfire Suppression,,,,,2024-08-28,2024,2024-09-01,2025-08-31,2025-08-31 00:00:00,,2024-08-08,075,Department of Health and Human Services,7529,National Institutes of Health,75N900,NATIONAL INSTITUTES OF HEALTH - CC,075,Department of Health and Human Services,7529,National Institutes of Health,75N900,NATIONAL INSTITUTES OF HEALTH - CC,075-2024/2025-3966-000,075-3966,25.2: Other services from non-Federal sources,0802: NIH ROYALTIES,X,NOT APPLICABLE,,,C44EL3MBJ2Z9,,MARTIN LOYD INC.,MARTIN LOYD INC.,,6QBE4,C44EL3MBJ2Z9,,MARTIN LOYD INC.,MARTIN LOYD INC.,USA,UNITED STATES,2112 DEER RIDGE DR,,STONE MOUNTAIN,13089,DEKALB,13,GA,GEORGIA,300871403,GA-04,GA-04,4046435322,4044804103,USA,UNITED STATES,BETHESDA,24031,MONTGOMERY,24,MD,MARYLAND,208920001,MD-08,MD-08,AWARD,C,DELIVERY ORDER,,,,,,,J,FIRM FIXED PRICE,EXERCISE OPTION 3,EXERCISE OPTION 3,,,,1,CL,CLOSELY ASSOCIATED,R401,SUPPORT- PROFESSIONAL: PERSONAL CARE (NON-MEDICAL),H,NOT BUNDLED,,,561210,FACILITIES SUPPORT SERVICES,C,NO CLAUSES INCLUDED AND NO SUSTAINABILITY INCLUDED,A,U.S. OWNED BUSINESS,,,,,E,NOT REQUIRED,USA,UNITED STATES,C,NOT A MANUFACTURED END PRODUCT,B,PLAN NOT REQUIRED,F,COMPETED UNDER SAP,SP1,SIMPLIFIED ACQUISITION,,,NONE,NO PREFERENCE USED,,,,,,,,D,COMMERCIAL PRODUCTS/SERVICES PROCEDURES NOT USED,f,N,NO,N,NO,Y,YES,N,NO,,N,NO,X,NOT APPLICABLE,Y,YES,X,NOT APPLICABLE,X,NOT APPLICABLE,,,B,IDC,S,SINGLE AWARD,,,,N,NO,X,NOT APPLICABLE EXEMPT FROM CAS,N,TRANSACTION DOES NOT USE GFE/GFP,,,X,NO,D,NOT CONSOLIDATED,Y,YES - SERVICE WHERE PBA IS USED.,N,NO,,,N,NO,X,NOT APPLICABLE,f,f,f,f,f,f,f,t,t,t,f,f,t,f,f,t,f,f,f,SMALL BUSINESS,S,f,f,f,f,f,f,f,f,f,f,f,f,f,f,f,f,f,CORPORATE NOT TAX EXEMPT,t,f,f,f,f,f,f,f,f,f,f,f,f,f,f,f,f,t,f,f,f,f,f,f,f,t,f,f,t,f,f,f,f,f,f,f,f,f,f,f,f,f,f,f,t,t,f,t,f,f,,,,,,,,,,,https://www.usaspending.gov/award/CONT_AWD_75N90024F00001_7529_75N90021D00032_7529/,2024-08-23,2024-08-28
8000_4732_80NSSC24FA305_P00001_47QTCA19D00EV_0,CONT_AWD_80NSSC24FA305_8000_47QTCA19D00EV_4732,80NSSC24FA305,P00001,0,4732,FEDERAL ACQUISITION SERVICE,47QTCA19D00EV,PO0009,0.00,160014.42,,0.00,160014.42,0.00,160014.42,Q: Not Designated Nonemergency/Emergency/Disaster/Wildfire Suppression,,,,,2024-08-28,2024,2024-02-21,2024-10-31,2024-10-31 00:00:00,,,080,National Aeronautics and Space Administration,8000,National Aeronautics and Space Administration,80NSSC,NASA SHARED SERVICES CENTER,080,National Aeronautics and Space Administration,8000,National Aeronautics and Space Administration,80NSSC,NASA SHARED SERVICES CENTER,080-2024/2025-0122-000,080-0122,25.1: Advisory and assistance services,"0001: SAFETY, SECURITY AND MISSION SERVICES (DIRECT)",X,NOT APPLICABLE,,,GM2HRFT252M3,,DATALOCK CONSULTING GROUP LLC,DATALOCK CONSULTING GROUP LLC,,7AMZ6,GM2HRFT252M3,,DATALOCK CONSULTING GROUP LLC,DATALOCK CONSULTING GROUP LLC,USA,UNITED STATES,13969 TANNERS HOUSE WAY,,CENTREVILLE,51059,FAIRFAX,51,VA,VIRGINIA,201214847,VA-11,VA-11,5712166059,,USA,UNITED STATES,CENTREVILLE,51059,FAIRFAX,51,VA,VIRGINIA,201214847,VA-11,VA-11,AWARD,C,DELIVERY ORDER,,,,,,,J,FIRM FIXED PRICE,TO PROVIDE PERSONAL IDENTITY VERIFICATION /DERIVED CREDENTIALS ASSESSMENT SERVICES SUPPORT,TO PROVIDE PERSONAL IDENTITY VERIFICATION /DERIVED CREDENTIALS ASSESSMENT SERVICES SUPPORT,M,OTHER ADMINISTRATIVE ACTION,,1,OT,OTHER FUNCTIONS,R401,SUPPORT- PROFESSIONAL: PERSONAL CARE (NON-MEDICAL),H,NOT BUNDLED,,,541511,CUSTOM COMPUTER PROGRAMMING SERVICES,C,NO CLAUSES INCLUDED AND NO SUSTAINABILITY INCLUDED,A,U.S. OWNED BUSINESS,,,,,E,NOT REQUIRED,USA,UNITED STATES,C,NOT A MANUFACTURED END PRODUCT,B,PLAN NOT REQUIRED,A,FULL AND OPEN COMPETITION,MAFO,SUBJECT TO MULTIPLE AWARD FAIR OPPORTUNITY,HZS,HUBZONE SOLE SOURCE,NONE,NO PREFERENCE USED,,,SS,SOLE SOURCE,,,1,A,COMMERCIAL PRODUCTS/SERVICES,f,N,NO,N,NO,Y,YES,N,NO,,N,NO,X,NOT APPLICABLE,N,NO,X,NOT APPLICABLE,X,NOT APPLICABLE,,,C,FSS,M,MULTIPLE AWARD,,,,,,X,NOT APPLICABLE EXEMPT FROM CAS,N,TRANSACTION DOES NOT USE GFE/GFP,,,X,NO,D,NOT CONSOLIDATED,N,NO - SERVICE WHERE PBA IS NOT USED.,,,,,N,NO,X,NOT APPLICABLE,f,f,f,f,f,f,f,f,f,f,f,f,t,f,f,f,f,f,t,SMALL BUSINESS,S,f,f,f,f,f,f,f,f,f,f,f,f,f,f,f,f,f,CORPORATE NOT TAX EXEMPT,t,f,f,f,f,f,f,f,f,f,f,f,f,f,f,f,f,t,f,f,f,f,f,f,f,f,t,f,t,f,f,f,f,f,f,f,f,f,f,f,f,f,f,f,f,t,f,f,f,f,,,,,,,,,,,https://www.usaspending.gov/award/CONT_AWD_80NSSC24FA305_8000_47QTCA19D00EV_4732/,2024-08-20,2024-08-28
7014_7014_70B03C24F00000547_P00001_70B03C21D00000044_0,CONT_AWD_70B03C24F00000547_7014_70B03C21D00000044_7014,70B03C24F00000547,P00001,0,7014,U.S. CUSTOMS AND BORDER PROTECTION,70B03C21D00000044,0,67579.75,4264627.15,,67579.75,4264627.15,270319.00,8664413.80,Q: Not Designated Nonemergency/Emergency/Disaster/Wildfire Suppression,,,,,2024-08-30,2024,2024-08-01,2024-09-15,2024-10-31 13:12:42,,2024-07-19,070,Department of Homeland Security,7014,U.S. Customs and Border Protection,70B03C,BORDER ENFORCEMENT CONTRACTING DIVISION,070,Department of Homeland Security,7014,U.S. Customs and Border Protection,70B023,OFFICE OF THE CHIEF MEDICAL OFFICER,070-2024/2024-0530-000,070-0530,25.2: Other services from non-Federal sources,"0005: P.L. 117-328, DIV. F., TITLE V, SEC. 546 - BORDER MANAGEMENT;0007: CAS - INTEGRATED OPERATIONS",X,NOT APPLICABLE,,,NMKBMMA32Q76,,COASTAL CLINICAL & MANAGEMENT SERVICES INC,"COASTAL CLINICAL AND MANAGEMENT SERVICES, INC.",,1E5Q8,JHPTNWL7NVU2,,COASTAL CLINICAL & MANAGEMENT SERVICES INC,COASTAL CLINICAL & MANAGEMENT SERVICES INC,USA,UNITED STATES,18 CAMPUS BLVD STE 100,,NEWTOWN SQUARE,42045,DELAWARE,42,PA,PENNSYLVANIA,190733240,PA-05,PA-05,4843802080,,USA,UNITED STATES,EL PASO,48141,EL PASO,48,TX,TEXAS,799012977,TX-16,TX-16,AWARD,C,DELIVERY ORDER,,,,,,,J,FIRM FIXED PRICE,ADDITIONAL CAREGIVER AND SUPERVISOR POSITIONS ADDED TO TASK ORDER REQUIREMENTS.,"CAREGIVERS TASK ORDER FROM IDIQ CONTRACT 70B03C21D00000044 FOR THE WEST REGION OF THE SWB AREA OF OPERATIONS - USBP SECTORS IN SAN DIEGO, YUMA, EL CENTRO, TUCSON AND EL PASO.",B,SUPPLEMENTAL AGREEMENT FOR WORK WITHIN SCOPE,,1,OT,OTHER FUNCTIONS,R401,SUPPORT- PROFESSIONAL: PERSONAL CARE (NON-MEDICAL),H,NOT BUNDLED,,,624190,OTHER INDIVIDUAL AND FAMILY SERVICES,C,NO CLAUSES INCLUDED AND NO SUSTAINABILITY INCLUDED,A,U.S. OWNED BUSINESS,,,,,E,NOT REQUIRED,USA,UNITED STATES,C,NOT A MANUFACTURED END PRODUCT,B,PLAN NOT REQUIRED,D,FULL AND OPEN COMPETITION AFTER EXCLUSION OF SOURCES,NP,NEGOTIATED PROPOSAL/QUOTE,,,NONE,NO PREFERENCE USED,,,,,,,,A,COMMERCIAL PRODUCTS/SERVICES,f,N,NO,N,NO,Y,YES,N,NO,,N,NO,X,NOT APPLICABLE,Y,YES,X,NOT APPLICABLE,X,NOT APPLICABLE,,,B,IDC,S,SINGLE AWARD,,,,N,NO,X,NOT APPLICABLE EXEMPT FROM CAS,N,TRANSACTION DOES NOT USE GFE/GFP,,,X,NO,D,NOT CONSOLIDATED,N,NO - SERVICE WHERE PBA IS NOT USED.,N,NO,,,N,NO,X,NOT APPLICABLE,f,f,f,f,f,f,f,t,t,t,f,f,f,f,f,f,f,f,f,SMALL BUSINESS,S,f,f,f,f,f,f,f,f,f,f,f,f,f,f,f,f,f,CORPORATE NOT TAX EXEMPT,t,f,f,f,f,f,f,f,f,f,f,f,f,f,f,f,f,t,f,f,f,f,f,f,f,f,f,f,t,f,f,f,f,f,f,f,f,f,f,f,f,f,f,f,f,f,f,f,f,f,,,,,,,,,,,https://www.usaspending.gov/award/CONT_AWD_70B03C24F00000547_7014_70B03C21D00000044_7014/,2024-08-30,2024-08-30
3600_-NONE-_36C24821D0076_P00007_-NONE-_-NONE-,CONT_IDV_36C24821D0076_3600,36C24821D0076,P00007,,,,,,0.00,0.00,,,,-15770.00,727081.00,,,,,,2024-09-02,2024,2021-07-15,,,2026-07-14,2021-01-26,036,Department of Veterans Affairs,3600,Department of Veterans Affairs,36C248,248-NETWORK CONTRACT OFFICE 8 (36C248),036,Department of Veterans Affairs,3600,Department of Veterans Affairs,36C248,248-NETWORK CONTRACT OFFICE 8 (36C248),,,,,X,NOT APPLICABLE,,,JC1YPFT4K474,,"TAMPA METROPOLITAN AREA YOUNG MEN'S CHRISTIAN ASSOCIATION, INC.","TAMPA METROPOLITAN AREA YOUNG MEN'S CHRISTIAN ASSOCIATION, INC.",,3L6P3,JC1YPFT4K474,,"TAMPA METROPOLITAN AREA YOUNG MEN'S CHRISTIAN ASSOCIATION, INC.",TAMPA METROPOLITAN AREA YOUNG MEN'S CHRISTIAN ASSOCIATION  INC.,USA,UNITED STATES,110 E OAK AVE,,TAMPA,12057,HILLSBOROUGH,12,FL,FLORIDA,336022210,FL-14,FL-14,8132249622,,,,,,,,,,,,,IDV,,,B,IDC,S,SINGLE AWARD,A,INDEFINITE DELIVERY / REQUIREMENTS,J,FIRM FIXED PRICE,"DE-OBLIGATE FY23, DECREASE QTY FOR OPT YR 2 (LIN# 2001). WHOLE HEALTH SERVICES YMCA FITNESS CENTER MEMBERSHIP AND FITNESS CLASSES.",WHOLE HEALTH SERVICES YMCA FITNESS CENTER MEMBERSHIP AND FITNESS CLASSES.,C,FUNDING ONLY ACTION,36C24821Q0443,,OT,OTHER FUNCTIONS,R401,SUPPORT- PROFESSIONAL: PERSONAL CARE (NON-MEDICAL),H,NOT BUNDLED,,,713940,FITNESS AND RECREATIONAL SPORTS CENTERS,C,NO CLAUSES INCLUDED AND NO SUSTAINABILITY INCLUDED,A,U.S. OWNED BUSINESS,,,,,,,,,,,B,PLAN NOT REQUIRED,B,NOT AVAILABLE FOR COMPETITION,SSS,ONLY ONE SOURCE,NONE,NO SET ASIDE USED.,NONE,NO PREFERENCE USED,,,,,OTH,AUTHORIZED BY STATUTE (FAR 6.302-5(A)(2)(I)),1,A,COMMERCIAL PRODUCTS/SERVICES,f,N,NO,N,NO,Y,YES,N,NO,,N,NO,X,NOT APPLICABLE,Y,YES,X,NOT APPLICABLE,X,NOT APPLICABLE,,,,,,,,,,N,NO,X,NOT APPLICABLE EXEMPT FROM CAS,N,TRANSACTION DOES NOT USE GFE/GFP,,,X,NO,D,NOT CONSOLIDATED,X,NOT APPLICABLE,Y,YES,,,,,X,NOT APPLICABLE,f,f,f,f,f,f,f,f,f,f,f,f,f,f,f,f,f,f,f,OTHER THAN SMALL BUSINESS,O,f,f,f,f,f,f,f,f,f,f,f,f,f,f,f,f,f,CORPORATE TAX EXEMPT,f,t,f,f,f,f,f,f,f,f,f,f,f,f,f,f,f,t,f,f,f,f,f,f,f,f,f,f,f,t,f,f,f,f,f,f,f,f,f,f,f,f,f,f,f,f,f,f,f,f,,,,,,,,,,,https://www.usaspending.gov/award/CONT_IDV_36C24821D0076_3600/,2024-08-26,2024-09-02
3600_3600_36C24823N0728_P00002_36C24821D0076_0,CONT_AWD_36C24823N0728_3600_36C24821D0076_3600,36C24823N0728,P00002,0,3600,"VETERANS AFFAIRS, DEPARTMENT OF",36C24821D0076,0,-15770.00,166830.00,,-15770.00,166830.00,-15770.00,166830.00,,,,,,2024-09-02,2024,2023-07-15,2024-07-14,2026-07-14 00:00:00,,2023-07-10,036,Department of Veterans Affairs,3600,Department of Veterans Affairs,36C248,248-NETWORK CONTRACT OFFICE 8 (36C248),036,Department of Veterans Affairs,3600,Department of Veterans Affairs,36C248,248-NETWORK CONTRACT OFFICE 8 (36C248),,,,,X,NOT APPLICABLE,,,JC1YPFT4K474,,"TAMPA METROPOLITAN AREA YOUNG MEN'S CHRISTIAN ASSOCIATION, INC.","TAMPA METROPOLITAN AREA YOUNG MEN'S CHRISTIAN ASSOCIATION, INC.",,3L6P3,JC1YPFT4K474,,"TAMPA METROPOLITAN AREA YOUNG MEN'S CHRISTIAN ASSOCIATION, INC.",TAMPA METROPOLITAN AREA YOUNG MEN'S CHRISTIAN ASSOCIATION  INC.,USA,UNITED STATES,110 E OAK AVE,,TAMPA,12057,HILLSBOROUGH,12,FL,FLORIDA,336022210,FL-14,FL-14,8132249622,,USA,UNITED STATES,TAMPA,12057,HILLSBOROUGH,12,FL,FLORIDA,336125000,FL-15,FL-15,AWARD,C,DELIVERY ORDER,,,,,,,J,FIRM FIXED PRICE,DE-OBLIGATE FY23 FUNDS FOR WHOLE HEALTH SERVICES YMCA FITNESS CENTER MEMBERSHIP AND FITNESS CLASSES.,WHOLE HEALTH SERVICES YMCA FITNESS CENTER MEMBERSHIP AND FITNESS CLASSES.,C,FUNDING ONLY ACTION,,1,OT,OTHER FUNCTIONS,R401,SUPPORT- PROFESSIONAL: PERSONAL CARE (NON-MEDICAL),H,NOT BUNDLED,,,713940,FITNESS AND RECREATIONAL SPORTS CENTERS,C,NO CLAUSES INCLUDED AND NO SUSTAINABILITY INCLUDED,A,U.S. OWNED BUSINESS,,,,,A,MEETS REQUIREMENTS,USA,UNITED STATES,C,NOT A MANUFACTURED END PRODUCT,B,PLAN NOT REQUIRED,B,NOT AVAILABLE FOR COMPETITION,SSS,ONLY ONE SOURCE,,,NONE,NO PREFERENCE USED,,,,,OTH,AUTHORIZED BY STATUTE (FAR 6.302-5(A)(2)(I)),,A,COMMERCIAL PRODUCTS/SERVICES,f,N,NO,N,NO,Y,YES,N,NO,,N,NO,X,NOT APPLICABLE,Y,YES,X,NOT APPLICABLE,X,NOT APPLICABLE,,,B,IDC,S,SINGLE AWARD,,,,N,NO,X,NOT APPLICABLE EXEMPT FROM CAS,N,TRANSACTION DOES NOT USE GFE/GFP,,,X,NO,D,NOT CONSOLIDATED,N,NO - SERVICE WHERE PBA IS NOT USED.,Y,YES,,,N,NO,X,NOT APPLICABLE,f,f,f,f,f,f,f,f,f,f,f,f,f,f,f,f,f,f,f,OTHER THAN SMALL BUSINESS,O,f,f,f,f,f,f,f,f,f,f,f,f,f,f,f,f,f,CORPORATE TAX EXEMPT,f,t,f,f,f,f,f,f,f,f,f,f,f,f,f,f,f,t,f,f,f,f,f,f,f,f,f,f,f,t,f,f,f,f,f,f,f,f,f,f,f,f,f,f,f,f,f,f,f,f,,,,,,,,,,,https://www.usaspending.gov/award/CONT_AWD_36C24823N0728_3600_36C24821D0076_3600/,2024-08-26,2024-09-02
3600_-NONE-_36C24923P0738_P00001_-NONE-_0,CONT_AWD_36C24923P0738_3600_-NONE-_-NONE-,36C24923P0738,P00001,0,,,,,75688.17,149173.32,,75688.17,149173.32,75688.17,149173.32,,,,,,2024-08-29,2024,2023-09-05,2025-09-04,2025-09-04 00:00:00,,2023-07-17,036,Department of Veterans Affairs,3600,Department of Veterans Affairs,36C249,249-NETWORK CONTRACT OFFICE 9 (36C249),036,Department of Veterans Affairs,3600,Department of Veterans Affairs,36C614,614-MEMPHIS(00614),,,,,X,NOT APPLICABLE,,,H2LJN48V3KD4,,"J.E. FEDERAL ENTERPRISES, LLC.","J.E. FEDERAL ENTERPRISES, LLC.",,79W40,H2LJN48V3KD4,,"J.E. FEDERAL ENTERPRISES, LLC.",J.E. FEDERAL ENTERPRISES  LLC.,USA,UNITED STATES,1455 REYNOLDS DR,,AUBURN,01081,LEE,01,AL,ALABAMA,368301869,AL-03,AL-03,8665159123,8665305497,USA,UNITED STATES,MEMPHIS,47157,SHELBY,47,TN,TENNESSEE,381040505,TN-09,TN-09,AWARD,B,PURCHASE ORDER,,,,,,,J,FIRM FIXED PRICE,MODIFICATION IS TO EXCERCISE OPTION 1. FROM 09/05/2024 TO 09/04/2025.,SERVICE IS REQUESTING ONLINE DATABASE SERVICE.,B,SUPPLEMENTAL AGREEMENT FOR WORK WITHIN SCOPE,,1,OT,OTHER FUNCTIONS,R401,SUPPORT- PROFESSIONAL: PERSONAL CARE (NON-MEDICAL),H,NOT BUNDLED,,,611430,PROFESSIONAL AND MANAGEMENT DEVELOPMENT TRAINING,C,NO CLAUSES INCLUDED AND NO SUSTAINABILITY INCLUDED,A,U.S. OWNED BUSINESS,,,,,E,NOT REQUIRED,USA,UNITED STATES,C,NOT A MANUFACTURED END PRODUCT,B,PLAN NOT REQUIRED,F,COMPETED UNDER SAP,SP1,SIMPLIFIED ACQUISITION,SDVOSBC,SERVICE DISABLED VETERAN OWNED SMALL BUSINESS SET-ASIDE,NONE,NO PREFERENCE USED,,,,,,,2,A,COMMERCIAL PRODUCTS/SERVICES,f,N,NO,,,X,NOT APPLICABLE,N,NO,,N,NO,X,NOT APPLICABLE,X,NOT APPLICABLE,X,NOT APPLICABLE,X,NOT APPLICABLE,,,,,,,,,,,,,,N,TRANSACTION DOES NOT USE GFE/GFP,,,X,NO,D,NOT CONSOLIDATED,N,NO - SERVICE WHERE PBA IS NOT USED.,,,,,N,NO,X,NOT APPLICABLE,f,f,f,f,f,t,t,f,f,f,f,f,f,f,f,f,f,f,f,SMALL BUSINESS,S,f,f,f,f,f,f,f,f,f,f,f,f,f,f,f,f,f,CORPORATE NOT TAX EXEMPT,t,f,f,f,f,f,f,f,f,f,f,f,f,f,f,f,f,t,f,f,f,f,f,f,f,f,t,f,t,f,f,f,f,f,f,f,f,f,f,f,f,f,f,f,f,f,f,f,f,f,,,,,,,,,,,https://www.usaspending.gov/award/CONT_AWD_36C24923P0738_3600_-NONE-_-NONE-/,2024-08-29,2024-09-03
3600_-NONE-_36C25923P1412_P00002_-NONE-_0,CONT_AWD_36C25923P1412_3600_-NONE-_-NONE-,36C25923P1412,P00002,0,,,,,9950.00,27200.00,,9950.00,27200.00,9950.00,67000.00,,,,,,2024-09-06,2024,2023-09-15,2025-09-14,2028-09-14 00:00:00,,2023-09-06,036,Department of Veterans Affairs,3600,Department of Veterans Affairs,36C259,NETWORK CONTRACT OFFICE 19 (36C259),036,Department of Veterans Affairs,3600,Department of Veterans Affairs,36C666,666-SHERIDAN(00666),,,,,X,NOT APPLICABLE,,,YWWCJXGQDDZ8,,ALERTUS TECHNOLOGIES LLC,ALERTUS TECHNOLOGIES LLC,,4Q1F6,YWWCJXGQDDZ8,,ALERTUS TECHNOLOGIES LLC,ALERTUS TECHNOLOGIES LLC,USA,UNITED STATES,10 N CHARLES ST,,BALTIMORE,24510,BALTIMORE (CITY),24,MD,MARYLAND,212013707,MD-07,MD-07,2028380021,,USA,UNITED STATES,SHERIDAN,56033,SHERIDAN,56,WY,WYOMING,828018320,WY-00,WY-00,AWARD,B,PURCHASE ORDER,,,,,,,J,FIRM FIXED PRICE,ALERTUS ENHANCED NOTIFICATION SERVICES,ALERTUS ENHANCED NOTIFICATION SERVICES,G,EXERCISE AN OPTION,,1,OT,OTHER FUNCTIONS,R401,SUPPORT- PROFESSIONAL: PERSONAL CARE (NON-MEDICAL),H,NOT BUNDLED,,,561621,SECURITY SYSTEMS SERVICES (EXCEPT LOCKSMITHS),C,NO CLAUSES INCLUDED AND NO SUSTAINABILITY INCLUDED,A,U.S. OWNED BUSINESS,,,,,A,MEETS REQUIREMENTS,USA,UNITED STATES,C,NOT A MANUFACTURED END PRODUCT,B,PLAN NOT REQUIRED,C,NOT COMPETED,SSS,ONLY ONE SOURCE,NONE,NO SET ASIDE USED.,NONE,NO PREFERENCE USED,,,,,ONE,ONLY ONE SOURCE-OTHER (FAR 6.302-1 OTHER),1,A,COMMERCIAL PRODUCTS/SERVICES,f,N,NO,,,N,NO,N,NO,,N,NO,X,NOT APPLICABLE,Y,YES,X,NOT APPLICABLE,X,NOT APPLICABLE,,,,,,,,,,,,,,N,TRANSACTION DOES NOT USE GFE/GFP,,,X,NO,D,NOT CONSOLIDATED,N,NO - SERVICE WHERE PBA IS NOT USED.,,,,,N,NO,X,NOT APPLICABLE,f,f,f,f,f,f,f,f,f,f,f,f,f,f,f,f,f,f,f,SMALL BUSINESS,S,f,f,f,f,f,f,f,f,f,f,f,f,f,f,f,f,f,OTHER,f,f,f,f,f,f,f,f,f,f,f,f,f,f,f,f,f,t,f,f,f,f,f,f,f,f,t,f,t,f,f,f,f,f,f,f,f,f,f,f,f,f,f,f,f,f,f,f,f,f,,,,,,,,,,,https://www.usaspending.gov/award/CONT_AWD_36C25923P1412_3600_-NONE-_-NONE-/,2024-09-06,2024-09-06
9700_-NONE-_FA251724A0006_0_-NONE-_-NONE-,CONT_IDV_FA251724A0006_9700,FA251724A0006,0,,,,,,0.00,0.00,,,,7500000.00,7500000.00,,,,,,2024-06-10,2024,2024-06-12,,,2029-06-11,,097,Department of Defense,5700,Department of the Air Force,FA2517,FA2517  21 CONS BLDG 350,097,Department of Defense,5700,Department of the Air Force,F8B6FS,FAMILY SUPPORT,,,,,X,NOT APPLICABLE,,,VC9HYNUUFH54,,PS LEARNING OF NORTH COLORADO SPRINGS LLC,PS LEARNING OF NORTH COLORADO SPRINGS LLC,PRIMROSE SCHOOL OF NORTH COLORADO SPRINGS,9WYM5,VC9HYNUUFH54,,PS LEARNING OF NORTH COLORADO SPRINGS LLC,PS LEARNING OF NORTH COLORADO SPRINGS LLC,USA,UNITED STATES,2380 BRIAR RIDGE PT,,COLORADO SPRINGS,08041,EL PASO,08,CO,COLORADO,809207740,CO-05,CO-05,7192680664,,,,,,,,,,,,,IDV,,,E,BPA,S,SINGLE AWARD,,,1,ORDER DEPENDENT (IDV ALLOWS PRICING ARRANGEMENT TO BE DETERMINED SEPARATELY FOR EACH ORDER),THIS REQUIREMENT IS FOR OFF-BASE CDC REFERRALS USING APPROPRIATED FUNDS.,THIS REQUIREMENT IS FOR OFF-BASE CDC REFERRALS USING APPROPRIATED FUNDS.,,,,,OT,OTHER FUNCTIONS,R401,SUPPORT- PROFESSIONAL: PERSONAL CARE (NON-MEDICAL),H,NOT BUNDLED,,,624410,CHILD CARE SERVICES,,,A,U.S. OWNED BUSINESS,,,,,,,,,,,,,,,,,,,,,,,,,,,,A,COMMERCIAL PRODUCTS/SERVICES,f,,,,,,,,,,N,NO,N,NO,N,NO,N,NO,X,NOT APPLICABLE,,,,,,,,,,,,X,NOT APPLICABLE EXEMPT FROM CAS,N,TRANSACTION DOES NOT USE GFE/GFP,,,X,NO,D,NOT CONSOLIDATED,X,NOT APPLICABLE,,,,,,,X,NOT APPLICABLE,f,f,f,f,f,t,f,t,f,f,f,f,f,f,f,f,f,f,f,SMALL BUSINESS,S,f,f,f,f,f,f,f,f,f,f,f,f,f,f,f,f,f,PARTNERSHIP,f,f,t,f,f,f,f,f,f,f,f,f,f,f,f,f,f,t,f,f,f,f,f,f,f,f,f,f,t,f,f,f,f,f,f,f,f,f,f,f,f,f,f,f,f,t,f,f,f,f,,,,,,,,,,,https://www.usaspending.gov/award/CONT_IDV_FA251724A0006_9700/,2024-06-03,2024-06-10
9700_9700_FA251724FG102_0_FA251724A0006_0,CONT_AWD_FA251724FG102_9700_FA251724A0006_9700,FA251724FG102,0,0,9700,DEPT OF DEFENSE,FA251724A0006,0,79325.45,79325.45,,79325.45,79325.45,79325.45,79325.45,,,,,,2024-06-10,2024,2024-06-10,2024-09-30,2024-09-30 00:00:00,,,097,Department of Defense,5700,Department of the Air Force,FA2517,FA2517  21 CONS BLDG 350,097,Department of Defense,5700,Department of the Air Force,F3L3FL,CHILD CARE MAIN,,,,,X,NOT APPLICABLE,,,VC9HYNUUFH54,,PS LEARNING OF NORTH COLORADO SPRINGS LLC,PS LEARNING OF NORTH COLORADO SPRINGS LLC,PRIMROSE SCHOOL OF NORTH COLORADO SPRINGS,9WYM5,VC9HYNUUFH54,,PS LEARNING OF NORTH COLORADO SPRINGS LLC,PS LEARNING OF NORTH COLORADO SPRINGS LLC,USA,UNITED STATES,2380 BRIAR RIDGE PT,,COLORADO SPRINGS,08041,EL PASO,08,CO,COLORADO,809207740,CO-05,CO-05,7192680664,,USA,UNITED STATES,COLORADO SPRINGS,08041,EL PASO,08,CO,COLORADO,809207740,CO-05,CO-05,AWARD,A,BPA CALL,,,,,,,J,FIRM FIXED PRICE,PETERSON SFB CHILD CARE,PETERSON SFB CHILD CARE,,,,5,OT,OTHER FUNCTIONS,R401,SUPPORT- PROFESSIONAL: PERSONAL CARE (NON-MEDICAL),H,NOT BUNDLED,,,624410,CHILD CARE SERVICES,C,NO CLAUSES INCLUDED AND NO SUSTAINABILITY INCLUDED,A,U.S. OWNED BUSINESS,000,NONE,Z,NOT IT PRODUCTS OR SERVICES,E,NOT REQUIRED,USA,UNITED STATES,C,NOT A MANUFACTURED END PRODUCT,B,PLAN NOT REQUIRED,G,NOT COMPETED UNDER SAP,SP1,SIMPLIFIED ACQUISITION,NONE,NO SET ASIDE USED.,NONE,NO PREFERENCE USED,,,,,SP2,SAP NON-COMPETITION (FAR 13),1,A,COMMERCIAL PRODUCTS/SERVICES,f,N,NO,,,N,NO,N,NO,,N,NO,N,NO,N,NO,N,NO,X,NOT APPLICABLE,,,E,BPA,S,SINGLE AWARD,,,,N,NO,X,NOT APPLICABLE EXEMPT FROM CAS,N,TRANSACTION DOES NOT USE GFE/GFP,,,X,NO,D,NOT CONSOLIDATED,Y,YES - SERVICE WHERE PBA IS USED.,,,Z,NOT APPLICABLE,Y,YES,X,NOT APPLICABLE,f,f,f,f,f,t,f,t,f,f,f,f,f,f,f,f,f,f,f,SMALL BUSINESS,S,f,f,f,f,f,f,f,f,f,f,f,f,f,f,f,f,f,PARTNERSHIP,f,f,t,f,f,f,f,f,f,f,f,f,f,f,f,f,f,t,f,f,f,f,f,f,f,f,f,f,t,f,f,f,f,f,f,f,f,f,f,f,f,f,f,f,f,t,f,f,f,f,,,,,,,,,,,https://www.usaspending.gov/award/CONT_AWD_FA251724FG102_9700_FA251724A0006_9700/,2024-08-01,2024-09-30
