contract_transaction_unique_key,contract_award_unique_key,award_id_piid,modification_number,transaction_number,parent_award_agency_id,parent_award_agency_name,parent_award_id_piid,parent_award_modification_number,federal_action_obligation,total_dollars_obligated,total_outlayed_amount_for_overall_award,base_and_exercised_options_value,current_total_value_of_award,base_and_all_options_value,potential_total_value_of_award,disaster_emergency_fund_codes_for_overall_award,outlayed_amount_from_COVID-19_supplementals_for_overall_award,obligated_amount_from_COVID-19_supplementals_for_overall_award,outlayed_amount_from_IIJA_supplemental_for_overall_award,obligated_amount_from_IIJA_supplemental_for_overall_award,action_date,action_date_fiscal_year,period_of_performance_start_date,period_of_performance_current_end_date,period_of_performance_potential_end_date,ordering_period_end_date,solicitation_date,awarding_agency_code,awarding_agency_name,awarding_sub_agency_code,awarding_sub_agency_name,awarding_office_code,awarding_office_name,funding_agency_code,funding_agency_name,funding_sub_agency_code,funding_sub_agency_name,funding_office_code,funding_office_name,treasury_accounts_funding_this_award,federal_accounts_funding_this_award,object_classes_funding_this_award,program_activities_funding_this_award,foreign_funding,foreign_funding_description,sam_exception,sam_exception_description,recipient_uei,recipient_duns,recipient_name,recipient_name_raw,recipient_doing_business_as_name,cage_code,recipient_parent_uei,recipient_parent_duns,recipient_parent_name,recipient_parent_name_raw,recipient_country_code,recipient_country_name,recipient_address_line_1,recipient_address_line_2,recipient_city_name,prime_award_transaction_recipient_county_fips_code,recipient_county_name,prime_award_transaction_recipient_state_fips_code,recipient_state_code,recipient_state_name,recipient_zip_4_code,prime_award_transaction_recipient_cd_original,prime_award_transaction_recipient_cd_current,recipient_phone_number,recipient_fax_number,primary_place_of_performance_country_code,primary_place_of_performance_country_name,primary_place_of_performance_city_name,prime_award_transaction_place_of_performance_county_fips_code,primary_place_of_performance_county_name,prime_award_transaction_place_of_performance_state_fips_code,primary_place_of_performance_state_code,primary_place_of_performance_state_name,primary_place_of_performance_zip_4,prime_award_transaction_place_of_performance_cd_original,prime_award_transaction_place_of_performance_cd_current,award_or_idv_flag,award_type_code,award_type,idv_type_code,idv_type,multiple_or_single_award_idv_code,multiple_or_single_award_idv,type_of_idc_code,type_of_idc,type_of_contract_pricing_code,type_of_contract_pricing,transaction_description,prime_award_base_transaction_description,action_type_code,action_type,solicitation_identifier,number_of_actions,inherently_governmental_functions,inherently_governmental_functions_description,product_or_service_code,product_or_service_code_description,contract_bundling_code,contract_bundling,dod_claimant_program_code,dod_claimant_program_description,naics_code,naics_description,recovered_materials_sustainability_code,recovered_materials_sustainability,domestic_or_foreign_entity_code,domestic_or_foreign_entity,dod_acquisition_program_code,dod_acquisition_program_description,information_technology_commercial_item_category_code,information_technology_commercial_item_category,epa_designated_product_code,epa_designated_product,country_of_product_or_service_origin_code,country_of_product_or_service_origin,place_of_manufacture_code,place_of_manufacture,subcontracting_plan_code,subcontracting_plan,extent_competed_code,extent_competed,solicitation_procedures_code,solicitation_procedures,type_of_set_aside_code,type_of_set_aside,evaluated_preference_code,evaluated_preference,research_code,research,fair_opportunity_limited_sources_code,fair_opportunity_limited_sources,other_than_full_and_open_competition_code,other_than_full_and_open_competition,number_of_offers_received,commercial_item_acquisition_procedures_code,commercial_item_acquisition_procedures,small_business_competitiveness_demonstration_program,simplified_procedures_for_certain_commercial_items_code,simplified_procedures_for_certain_commercial_items,a76_fair_act_action_code,a76_fair_act_action,fed_biz_opps_code,fed_biz_opps,local_area_set_aside_code,local_area_set_aside,price_evaluation_adjustment_preference_percent_difference,clinger_cohen_act_planning_code,clinger_cohen_act_planning,materials_supplies_articles_equipment_code,materials_supplies_articles_equipment,labor_standards_code,labor_standards,construction_wage_rate_requirements_code,construction_wage_rate_requirements,interagency_contracting_authority_code,interagency_contracting_authority,other_statutory_authority,program_acronym,parent_award_type_code,parent_award_type,parent_award_single_or_multiple_code,parent_award_single_or_multiple,major_program,national_interest_action_code,national_interest_action,cost_or_pricing_data_code,cost_or_pricing_data,cost_accounting_standards_clause_code,cost_accounting_standards_clause,government_furnished_property_code,government_furnished_property,sea_transportation_code,sea_transportation,undefinitized_action_code,undefinitized_action,consolidated_contract_code,consolidated_contract,performance_based_service_acquisition_code,performance_based_service_acquisition,multi_year_contract_code,multi_year_contract,contract_financing_code,contract_financing,purchase_card_as_payment_method_code,purchase_card_as_payment_method,contingency_humanitarian_or_peacekeeping_operation_code,contingency_humanitarian_or_peacekeeping_operation,alaskan_native_corporation_owned_firm,american_indian_owned_business,indian_tribe_federally_recognized,native_hawaiian_organization_owned_firm,tribally_owned_firm,veteran_owned_business,service_disabled_veteran_owned_business,woman_owned_business,women_owned_small_business,economically_disadvantaged_women_owned_small_business,joint_venture_women_owned_small_business,joint_venture_economic_disadvantaged_women_owned_small_bus,minority_owned_business,subcontinent_asian_asian_indian_american_owned_business,asian_pacific_american_owned_business,black_american_owned_business,hispanic_american_owned_business,native_american_owned_business,other_minority_owned_business,contracting_officers_determination_of_business_size,contracting_officers_determination_of_business_size_code,emerging_small_business,community_developed_corporation_owned_firm,labor_surplus_area_firm,us_federal_government,federally_funded_research_and_development_corp,federal_agency,us_state_government,us_local_government,city_local_government,county_local_government,inter_municipal_local_government,local_government_owned,municipality_local_government,school_district_local_government,township_local_government,us_tribal_government,foreign_government,organizational_type,corporate_entity_not_tax_exempt,corporate_entity_tax_exempt,partnership_or_limited_liability_partnership,sole_proprietorship,small_agricultural_cooperative,international_organization,us_government_entity,community_development_corporation,domestic_shelter,educational_institution,foundation,hospital_flag,manufacturer_of_goods,veterinary_hospital,hispanic_servicing_institution,receives_contracts,receives_financial_assistance,receives_contracts_and_financial_assistance,airport_authority,council_of_governments,housing_authorities_public_tribal,interstate_entity,planning_commission,port_authority,transit_authority,subchapter_scorporation,limited_liability_corporation,foreign_owned,for_profit_organization,nonprofit_organization,other_not_for_profit_organization,the_ability_one_program,private_university_or_college,state_controlled_institution_of_higher_learning,1862_land_grant_college,1890_land_grant_college,1994_land_grant_college,minority_institution,historically_black_college,tribal_college,alaskan_native_servicing_institution,native_hawaiian_servicing_institution,school_of_forestry,veterinary_college,dot_certified_disadvantage,self_certified_small_disadvantaged_business,small_disadvantaged_business,c8a_program_participant,historically_underutilized_business_zone_hubzone_firm,sba_certified_8a_joint_venture,highly_compensated_officer_1_name,highly_compensated_officer_1_amount,highly_compensated_officer_2_name,highly_compensated_officer_2_amount,highly_compensated_officer_3_name,highly_compensated_officer_3_amount,highly_compensated_officer_4_name,highly_compensated_officer_4_amount,highly_compensated_officer_5_name,highly_compensated_officer_5_amount,usaspending_permalink,initial_report_date,last_modified_date
3600_-NONE-_36C24923C0013_P00001_-NONE-_0,CONT_AWD_36C24923C0013_3600_-NONE-_-NONE-,36C24923C0013,P00001,0,,,,,82341.36,163425.60,,82341.36,163425.60,0.00,416735.28,,,,,,2023-10-01,2024,2022-10-01,2024-09-30,2027-09-30 00:00:00,,2022-08-30,036,Department of Veterans Affairs,3600,Department of Veterans Affairs,36C249,249-NETWORK CONTRACT OFFICE 9 (36C249),036,Department of Veterans Affairs,3600,Department of Veterans Affairs,36C626,626-NASHVILLE (00626),,,,,X,NOT APPLICABLE,,,H2LJN48V3KD4,,"J.E. FEDERAL ENTERPRISES, LLC.","J.E. FEDERAL ENTERPRISES, LLC.",,79W40,H2LJN48V3KD4,,"J.E. FEDERAL ENTERPRISES, LLC.",J.E. FEDERAL ENTERPRISES  LLC.,USA,UNITED STATES,1455 REYNOLDS DR,,AUBURN,01081,LEE,01,AL,ALABAMA,368301869,AL-03,AL-03,8665159123,8665305497,USA,UNITED STATES,NASHVILLE,47037,DAVIDSON,47,TN,TENNESSEE,372124962,TN-07,TN-05,AWARD,D,DEFINITIVE CONTRACT,,,,,,,J,FIRM FIXED PRICE,TVHS EMPLOYEE ASSISTANCE PROGRAM OP YR1,TVHS EMPLOYEE ASSISTANCE PROGRAM,G,EXERCISE AN OPTION,36C24922Q0664,1,OT,OTHER FUNCTIONS,R401,SUPPORT- PROFESSIONAL: PERSONAL CARE (NON-MEDICAL),H,NOT BUNDLED,,,621330,OFFICES OF MENTAL HEALTH PRACTITIONERS (EXCEPT PHYSICIANS),C,NO CLAUSES INCLUDED AND NO SUSTAINABILITY INCLUDED,A,U.S. OWNED BUSINESS,,,,,E,NOT REQUIRED,USA,UNITED STATES,C,NOT A MANUFACTURED END PRODUCT,B,PLAN NOT REQUIRED,B,NOT AVAILABLE FOR COMPETITION,SSS,ONLY ONE SOURCE,SDVOSBS,SDVOSB SOLE SOURCE,NONE,NO PREFERENCE USED,,,,,OTH,AUTHORIZED BY STATUTE (FAR 6.302-5(A)(2)(I)),1,A,COMMERCIAL PRODUCTS/SERVICES,f,N,NO,N,NO,Y,YES,N,NO,0.00,N,NO,X,NOT APPLICABLE,X,NOT APPLICABLE,X,NOT APPLICABLE,X,NOT APPLICABLE,,,,,,,,NONE,NONE,N,NO,X,NOT APPLICABLE EXEMPT FROM CAS,N,TRANSACTION DOES NOT USE GFE/GFP,,,X,NO,D,NOT CONSOLIDATED,Y,YES - SERVICE WHERE PBA IS USED.,N,NO,,,N,NO,X,NOT APPLICABLE,f,f,f,f,f,t,t,f,f,f,f,f,f,f,f,f,f,f,f,SMALL BUSINESS,S,f,f,f,f,f,f,f,f,f,f,f,f,f,f,f,f,f,CORPORATE NOT TAX EXEMPT,t,f,f,f,f,f,f,f,f,f,f,f,f,f,f,f,f,t,f,f,f,f,f,f,f,f,t,f,t,f,f,f,f,f,f,f,f,f,f,f,f,f,f,f,f,f,f,f,f,f,,,,,,,,,,,https://www.usaspending.gov/award/CONT_AWD_36C24923C0013_3600_-NONE-_-NONE-/,2023-08-11,2023-10-01
3600_3600_36C24424N0014_0_36C24420A0003_0,CONT_AWD_36C24424N0014_3600_36C24420A0003_3600,36C24424N0014,0,0,3600,"VETERANS AFFAIRS, DEPARTMENT OF",36C24420A0003,0,39208.00,39208.00,,39208.00,39208.00,39208.00,39208.00,,,,,,2023-10-01,2024,2023-10-01,2024-09-30,2024-09-30 00:00:00,,2023-10-01,036,Department of Veterans Affairs,3600,Department of Veterans Affairs,36C244,244-NETWORK CONTRACT OFFICE 4 (36C244),036,Department of Veterans Affairs,3600,Department of Veterans Affairs,36C529,529-BUTLER (00529)(36C529),,,,,X,NOT APPLICABLE,,,NW46XKYHER84,,BUTLER COUNTY FAMILY YOUNG MENS CHRISTIAN ASSOCIATION,BUTLER COUNTY FAMILY YOUNG MEN'S CHRISTIAN ASSOCIATION,BUTLER YMCA,4QRN5,NW46XKYHER84,,BUTLER COUNTY FAMILY YOUNG MENS CHRISTIAN ASSOCIATION,BUTLER COUNTY FAMILY YOUNG MEN'S CHRISTIAN ASSOCIATION,USA,UNITED STATES,339 N WASHINGTON ST,,BUTLER,42019,BUTLER,42,PA,PENNSYLVANIA,160015261,PA-03,PA-16,7242874733,7242871007,USA,UNITED STATES,BUTLER,42019,BUTLER,42,PA,PENNSYLVANIA,160012418,PA-16,PA-16,AWARD,A,BPA CALL,,,,,,,J,FIRM FIXED PRICE,YMCA PERSONAL TRAINING AGREEMENT,YMCA PERSONAL TRAINING AGREEMENT,,,,1,OT,OTHER FUNCTIONS,R401,SUPPORT- PROFESSIONAL: PERSONAL CARE (NON-MEDICAL),H,NOT BUNDLED,,,713940,FITNESS AND RECREATIONAL SPORTS CENTERS,C,NO CLAUSES INCLUDED AND NO SUSTAINABILITY INCLUDED,A,U.S. OWNED BUSINESS,,,,,E,NOT REQUIRED,USA,UNITED STATES,C,NOT A MANUFACTURED END PRODUCT,B,PLAN NOT REQUIRED,F,COMPETED UNDER SAP,SP1,SIMPLIFIED ACQUISITION,NONE,NO SET ASIDE USED.,NONE,NO PREFERENCE USED,,,,,,,1,A,COMMERCIAL PRODUCTS/SERVICES,f,N,NO,N,NO,,,N,NO,,N,NO,X,NOT APPLICABLE,Y,YES,X,NOT APPLICABLE,X,NOT APPLICABLE,,,E,BPA,S,SINGLE AWARD,,NONE,NONE,,,X,NOT APPLICABLE EXEMPT FROM CAS,N,TRANSACTION DOES NOT USE GFE/GFP,,,X,NO,D,NOT CONSOLIDATED,N,NO - SERVICE WHERE PBA IS NOT USED.,,,,,N,NO,X,NOT APPLICABLE,f,f,f,f,f,f,f,f,f,f,f,f,f,f,f,f,f,f,f,OTHER THAN SMALL BUSINESS,O,f,f,f,f,f,f,f,f,f,f,f,f,f,f,f,f,f,CORPORATE TAX EXEMPT,f,t,f,f,f,f,f,f,f,f,f,f,f,f,f,f,f,t,f,f,f,f,f,f,f,f,f,f,f,t,f,f,f,f,f,f,f,f,f,f,f,f,f,f,f,f,f,f,f,f,,,,,,,,,,,https://www.usaspending.gov/award/CONT_AWD_36C24424N0014_3600_36C24420A0003_3600/,2023-09-25,2023-10-01
2900_2900_29FTC121F0022_P00019_FTC16A6002_0,CONT_AWD_29FTC121F0022_2900_FTC16A6002_2900,29FTC121F0022,P00019,0,2900,FEDERAL TRADE COMMISSION,FTC16A6002,2,0.00,1375502.15,1293151.08,0.00,2643952.71,0.00,2643952.71,Q: Not Designated Nonemergency/Emergency/Disaster/Wildfire Suppression,,,,,2023-10-11,2024,2021-04-26,2024-04-25,2024-04-25 00:00:00,,2021-03-04,029,Federal Trade Commission,2900,Federal Trade Commission,29FTC1,OFFICE OF ACQUISITION,029,Federal Trade Commission,2900,Federal Trade Commission,29FTC1,OFFICE OF ACQUISITION,029-X-0100-000,029-0100,25.1: Advisory and assistance services;31.0: Equipment,0001: PROTECT CONSUMERS;0002: MAINTAIN COMPETITION,X,NOT APPLICABLE,,,VHXWYLNJSK45,,ROCK CREEK PUBLISHING GROUP INC.,ROCK CREEK PUBLISHING GROUP INC.,,1XH42,TFHAW6MVF553,,BYTECUBED LLC,ROCK CREEK PUBLISHING GROUP INC.,USA,UNITED STATES,1800 MASSACHUSETTS AVE NW 2FL,,WASHINGTON,11001,DISTRICT OF COLUMBIA,11,DC,DISTRICT OF COLUMBIA,200361806,DC-11,DC-98,2027910068,,USA,UNITED STATES,WASHINGTON,11001,DISTRICT OF COLUMBIA,11,DC,DISTRICT OF COLUMBIA,205800002,DC-98,DC-98,AWARD,A,BPA CALL,,,,,,,Y,TIME AND MATERIALS,DRUPAL WEBSITE MAINTENANCE,DRUPAL WEBSITE MAINTENANCE,M,OTHER ADMINISTRATIVE ACTION,,1,OT,OTHER FUNCTIONS,R401,SUPPORT- PROFESSIONAL: PERSONAL CARE (NON-MEDICAL),H,NOT BUNDLED,,,541613,MARKETING CONSULTING SERVICES,C,NO CLAUSES INCLUDED AND NO SUSTAINABILITY INCLUDED,A,U.S. OWNED BUSINESS,,,,,E,NOT REQUIRED,USA,UNITED STATES,C,NOT A MANUFACTURED END PRODUCT,,,A,FULL AND OPEN COMPETITION,MAFO,SUBJECT TO MULTIPLE AWARD FAIR OPPORTUNITY,,,NONE,NO PREFERENCE USED,,,FAIR,FAIR OPPORTUNITY GIVEN,,,,A,COMMERCIAL PRODUCTS/SERVICES,f,N,NO,N,NO,,,N,NO,,N,NO,X,NOT APPLICABLE,Y,YES,X,NOT APPLICABLE,X,NOT APPLICABLE,,,E,BPA,S,SINGLE AWARD,,NONE,NONE,,,,,N,TRANSACTION DOES NOT USE GFE/GFP,,,X,NO,D,NOT CONSOLIDATED,N,NO - SERVICE WHERE PBA IS NOT USED.,,,,,N,NO,X,NOT APPLICABLE,f,f,f,f,f,f,f,t,t,f,f,f,t,f,f,t,f,f,f,SMALL BUSINESS,S,f,f,f,f,f,f,f,f,f,f,f,f,f,f,f,f,f,CORPORATE NOT TAX EXEMPT,t,f,f,f,f,f,f,f,f,f,f,f,f,f,f,f,f,t,f,f,f,f,f,f,f,t,f,f,t,f,f,f,f,f,f,f,f,f,f,f,f,f,f,f,f,t,f,f,f,f,PETER  FIRTH,911915.00,MICHAEL  PANSKY,760724.00,CASS  PANCIOCCO,693325.00,KHALID  HASSOUNEH,684764.00,DOM  LAPORE,623517.00,https://www.usaspending.gov/award/CONT_AWD_29FTC121F0022_2900_FTC16A6002_2900/,2023-10-11,2023-10-11
7529_7529_75N98023F00004_P00002_75N98021A00089_0,CONT_AWD_75N98023F00004_7529_75N98021A00089_7529,75N98023F00004,P00002,0,7529,NATIONAL INSTITUTES OF HEALTH,75N98021A00089,P00006,0.00,246483.91,246483.91,0.00,246483.91,0.00,246483.91,Q: Not Designated Nonemergency/Emergency/Disaster/Wildfire Suppression,,,,,2023-10-11,2024,2023-07-17,2024-04-04,2024-04-04 00:00:00,,,075,Department of Health and Human Services,7529,National Institutes of Health,75N980,NATIONAL INSTITUTES OF HEALTH OLAO,075,Department of Health and Human Services,7529,National Institutes of Health,75N98E,NATIONAL INSTITUTE OF HEALTH NIH-OD,075-2023/2023-0846-000,075-0846,25.2: Other services from non-Federal sources,0025: NIH OFFICE OF THE DIRECTOR (0846),X,NOT APPLICABLE,,,MAA3SBSDQVM1,,KPMG LLP,KPMG LLP,,7QEG9,Y8QAHVPB6AH5,,KPMG L.L.P.,KPMG L.L.P.,USA,UNITED STATES,8350 BROAD ST STE 900,,MC LEAN,51059,FAIRFAX,51,VA,VIRGINIA,221025150,VA-11,VA-11,7038996186,,USA,UNITED STATES,BETHESDA,24031,MONTGOMERY,24,MD,MARYLAND,208100002,MD-08,MD-08,AWARD,A,BPA CALL,,,,,,,J,FIRM FIXED PRICE,SUPPORT THE NIH RISK MANAGEMENT PROGRAM,SUPPORT THE NIH RISK MANAGEMENT PROGRAM,M,OTHER ADMINISTRATIVE ACTION,,1,CL,CLOSELY ASSOCIATED,R401,SUPPORT- PROFESSIONAL: PERSONAL CARE (NON-MEDICAL),H,NOT BUNDLED,,,541211,OFFICES OF CERTIFIED PUBLIC ACCOUNTANTS,C,NO CLAUSES INCLUDED AND NO SUSTAINABILITY INCLUDED,A,U.S. OWNED BUSINESS,,,,,E,NOT REQUIRED,USA,UNITED STATES,C,NOT A MANUFACTURED END PRODUCT,,,A,FULL AND OPEN COMPETITION,MAFO,SUBJECT TO MULTIPLE AWARD FAIR OPPORTUNITY,,,NONE,NO PREFERENCE USED,,,FAIR,FAIR OPPORTUNITY GIVEN,,,,A,COMMERCIAL PRODUCTS/SERVICES,f,N,NO,N,NO,,,N,NO,,N,NO,X,NOT APPLICABLE,Y,YES,X,NOT APPLICABLE,X,NOT APPLICABLE,,,E,BPA,S,SINGLE AWARD,RISK MANAGEMENT SUPPORT SERVICES,NONE,NONE,,,X,NOT APPLICABLE EXEMPT FROM CAS,N,TRANSACTION DOES NOT USE GFE/GFP,,,X,NO,D,NOT CONSOLIDATED,N,NO - SERVICE WHERE PBA IS NOT USED.,,,,,N,NO,X,NOT APPLICABLE,f,f,f,f,f,f,f,f,f,f,f,f,f,f,f,f,f,f,f,OTHER THAN SMALL BUSINESS,O,f,f,f,f,f,f,f,f,f,f,f,f,f,f,f,f,f,PARTNERSHIP,f,f,t,f,f,f,f,f,f,f,f,f,f,f,f,f,f,t,f,f,f,f,f,f,f,f,f,f,t,f,f,f,f,f,f,f,f,f,f,f,f,f,f,f,f,f,f,f,f,f,,,,,,,,,,,https://www.usaspending.gov/award/CONT_AWD_75N98023F00004_7529_75N98021A00089_7529/,2023-10-11,2024-09-10
2036_2001_2033H621F00037_P00007_2032H319A00001_0,CONT_AWD_2033H621F00037_2036_2032H319A00001_2001,2033H621F00037,P00007,0,2001,DEPARTMENTAL OFFICES,2032H319A00001,P00002,6555.00,154445.82,179817.44,6555.00,154445.82,0.00,198156.42,Q: Not Designated Nonemergency/Emergency/Disaster/Wildfire Suppression,,,,,2023-10-12,2024,2020-10-23,2024-10-22,2024-10-22 00:00:00,,,020,Department of the Treasury,2036,Bureau of the Fiscal Service,2033H6,FISCAL SERVICE,020,Department of the Treasury,2036,Bureau of the Fiscal Service,2033H6,FISCAL SERVICE,020-2021/2021-0520-000;020-2022/2022-0520-000;020-2023/2023-0520-000;020-2024/2024-0520-000,020-0520,25.1: Advisory and assistance services;25.2: Other services from non-Federal sources,0001: COLLECTIONS;0005: ACCOUNTING AND REPORTING;0006: PAYMENTS;0007: RETAIL SECURITIES SERVICES;0009: WHOLESALE SECURITIES SERVICES,X,NOT APPLICABLE,,,ZX23KR32ZH32,,CADUCEUS HEALTHCARE INC,CADUCEUS HEALTHCARE INC,,5AQA8,CBCRY3E8E9M1,,CADUCEUS HEALTHCARE INC,CADUCEUS HEALTHCARE INC,USA,UNITED STATES,57 FORSYTH ST NW,APT 2D,ATLANTA,13121,FULTON,13,GA,GEORGIA,303032229,GA-05,GA-05,7703572400,7703570003,USA,UNITED STATES,HYATTSVILLE,24033,PRINCE GEORGES,24,MD,MARYLAND,207850207,MD-04,MD-04,AWARD,A,BPA CALL,,,,,,,J,FIRM FIXED PRICE,PERSONAL ASSISTANT SUPPORT SERVICES,PERSONAL ASSISTANT SUPPORT SERVICES,G,EXERCISE AN OPTION,,1,OT,OTHER FUNCTIONS,R401,SUPPORT- PROFESSIONAL: PERSONAL CARE (NON-MEDICAL),H,NOT BUNDLED,,,541611,ADMINISTRATIVE MANAGEMENT AND GENERAL MANAGEMENT CONSULTING SERVICES,C,NO CLAUSES INCLUDED AND NO SUSTAINABILITY INCLUDED,A,U.S. OWNED BUSINESS,,,,,A,MEETS REQUIREMENTS,USA,UNITED STATES,C,NOT A MANUFACTURED END PRODUCT,,,A,FULL AND OPEN COMPETITION,MAFO,SUBJECT TO MULTIPLE AWARD FAIR OPPORTUNITY,,,NONE,NO PREFERENCE USED,,,CSA,COMPETITIVE SET ASIDE,,,,A,COMMERCIAL PRODUCTS/SERVICES,f,,,N,NO,X,NOT APPLICABLE,N,NO,,N,NO,X,NOT APPLICABLE,N,NO,X,NOT APPLICABLE,X,NOT APPLICABLE,,,E,BPA,S,SINGLE AWARD,,NONE,NONE,N,NO,,,N,TRANSACTION DOES NOT USE GFE/GFP,,,X,NO,D,NOT CONSOLIDATED,N,NO - SERVICE WHERE PBA IS NOT USED.,,,Z,NOT APPLICABLE,N,NO,X,NOT APPLICABLE,f,f,f,f,f,t,t,f,f,f,f,f,t,f,f,f,t,f,f,SMALL BUSINESS,S,f,f,f,f,f,f,f,f,f,f,f,f,f,f,f,f,f,CORPORATE NOT TAX EXEMPT,t,f,f,f,f,f,f,f,f,f,f,f,f,f,f,f,f,t,f,f,f,f,f,f,f,t,f,f,t,f,f,f,f,f,f,f,f,f,f,f,f,f,f,f,t,t,f,t,f,f,,,,,,,,,,,https://www.usaspending.gov/award/CONT_AWD_2033H621F00037_2036_2032H319A00001_2001/,2023-09-18,2023-10-12
7014_7014_70B03C21F00001536_P00004_70B03C21D00000044_0,CONT_AWD_70B03C21F00001536_7014_70B03C21D00000044_7014,70B03C21F00001536,P00004,0,7014,U.S. CUSTOMS AND BORDER PROTECTION,70B03C21D00000044,0,-117064.32,1984472.40,170262.48,-117064.32,1984472.40,-117064.32,1984472.40,Q: Not Designated Nonemergency/Emergency/Disaster/Wildfire Suppression,,,,,2024-10-29,2025,2021-09-30,2022-09-29,2022-09-29 00:00:00,,2021-09-30,070,Department of Homeland Security,7014,U.S. Customs and Border Protection,70B03C,BORDER ENFORCEMENT CONTRACTING DIVISION,070,Department of Homeland Security,7014,U.S. Customs and Border Protection,70B003,US BORDER PATROL,070-2021/2021-0530-000;070-2022/2022-0530-000,070-0530,25.2: Other services from non-Federal sources,0005: CAS - BORDER SECURITY OPERATIONS;0New: SEC. 543 SWB,X,NOT APPLICABLE,,,NMKBMMA32Q76,,COASTAL CLINICAL & MANAGEMENT SERVICES INC,"COASTAL CLINICAL AND MANAGEMENT SERVICES, INC.",,1E5Q8,JHPTNWL7NVU2,,COASTAL CLINICAL & MANAGEMENT SERVICES INC,COASTAL CLINICAL & MANAGEMENT SERVICES INC,USA,UNITED STATES,18 CAMPUS BLVD STE 100,,NEWTOWN SQUARE,42045,DELAWARE,42,PA,PENNSYLVANIA,190733240,PA-08,PA-05,4843802080,,USA,UNITED STATES,EL PASO,48141,EL PASO,48,TX,TEXAS,799011953,TX-16,TX-16,AWARD,C,DELIVERY ORDER,,,,,,,J,FIRM FIXED PRICE,DE-OBLIGATION OF EXCESS UNUSED FUNDING.,TASK ORDER #1 FOR THE SWB CAREGIVERS IDIQ CONTRACT FOR THE WESTERN REGION. CAREGIVER SERVICES FOR THE USBP EL PASO SECTOR AREA OF OPERATIONS.,C,FUNDING ONLY ACTION,,1,OT,OTHER FUNCTIONS,R401,SUPPORT- PROFESSIONAL: PERSONAL CARE (NON-MEDICAL),H,NOT BUNDLED,,,624190,OTHER INDIVIDUAL AND FAMILY SERVICES,C,NO CLAUSES INCLUDED AND NO SUSTAINABILITY INCLUDED,A,U.S. OWNED BUSINESS,,,,,E,NOT REQUIRED,USA,UNITED STATES,C,NOT A MANUFACTURED END PRODUCT,B,PLAN NOT REQUIRED,D,FULL AND OPEN COMPETITION AFTER EXCLUSION OF SOURCES,NP,NEGOTIATED PROPOSAL/QUOTE,,,NONE,NO PREFERENCE USED,,,,,,,,A,COMMERCIAL PRODUCTS/SERVICES,f,N,NO,N,NO,Y,YES,N,NO,,N,NO,X,NOT APPLICABLE,Y,YES,X,NOT APPLICABLE,X,NOT APPLICABLE,,,B,IDC,S,SINGLE AWARD,,,,N,NO,,,N,TRANSACTION DOES NOT USE GFE/GFP,,,X,NO,D,NOT CONSOLIDATED,N,NO - SERVICE WHERE PBA IS NOT USED.,N,NO,,,N,NO,X,NOT APPLICABLE,f,f,f,f,f,f,f,t,t,t,f,f,f,f,f,f,f,f,f,SMALL BUSINESS,S,f,f,f,f,f,f,f,f,f,f,f,f,f,f,f,f,f,CORPORATE NOT TAX EXEMPT,t,f,f,f,f,f,f,f,f,f,f,f,f,f,f,f,f,t,f,f,f,f,f,f,f,f,f,f,t,f,f,f,f,f,f,f,f,f,f,f,f,f,f,f,f,f,f,f,f,f,,,,,,,,,,,https://www.usaspending.gov/award/CONT_AWD_70B03C21F00001536_7014_70B03C21D00000044_7014/,2023-06-16,2024-10-29
7529_7529_75N98024F00001_0_75N98021A00089_0,CONT_AWD_75N98024F00001_7529_75N98021A00089_7529,75N98024F00001,0,0,7529,NATIONAL INSTITUTES OF HEALTH,75N98021A00089,P00006,155005.11,155005.11,116253.81,155005.11,155005.11,155005.11,155005.11,Q: Not Designated Nonemergency/Emergency/Disaster/Wildfire Suppression,,,,,2023-10-17,2024,2023-10-19,2024-10-18,2024-10-18 00:00:00,,,075,Department of Health and Human Services,7529,National Institutes of Health,75N980,NATIONAL INSTITUTES OF HEALTH OLAO,075,Department of Health and Human Services,7529,National Institutes of Health,75N98E,NATIONAL INSTITUTE OF HEALTH NIH-OD,075-X-4554-000,075-4554,25.2: Other services from non-Federal sources,0801: NIH REIMBURSABLE - OTHER,X,NOT APPLICABLE,,,MAA3SBSDQVM1,,KPMG LLP,KPMG LLP,,7QEG9,Y8QAHVPB6AH5,,KPMG L.L.P.,KPMG L.L.P.,USA,UNITED STATES,8350 BROAD ST STE 900,,MC LEAN,51059,FAIRFAX,51,VA,VIRGINIA,221025150,VA-11,VA-11,7038996186,,USA,UNITED STATES,BETHESDA,24031,MONTGOMERY,24,MD,MARYLAND,208100002,MD-08,MD-08,AWARD,A,BPA CALL,,,,,,,J,FIRM FIXED PRICE,SUPPORT THE NIH RISK MANAGEMENT PROGRAM,SUPPORT THE NIH RISK MANAGEMENT PROGRAM,,,,1,CL,CLOSELY ASSOCIATED,R401,SUPPORT- PROFESSIONAL: PERSONAL CARE (NON-MEDICAL),H,NOT BUNDLED,,,541211,OFFICES OF CERTIFIED PUBLIC ACCOUNTANTS,C,NO CLAUSES INCLUDED AND NO SUSTAINABILITY INCLUDED,A,U.S. OWNED BUSINESS,,,,,E,NOT REQUIRED,USA,UNITED STATES,C,NOT A MANUFACTURED END PRODUCT,,,A,FULL AND OPEN COMPETITION,MAFO,SUBJECT TO MULTIPLE AWARD FAIR OPPORTUNITY,,,NONE,NO PREFERENCE USED,,,FAIR,FAIR OPPORTUNITY GIVEN,,,,A,COMMERCIAL PRODUCTS/SERVICES,f,N,NO,N,NO,,,N,NO,,N,NO,X,NOT APPLICABLE,Y,YES,X,NOT APPLICABLE,X,NOT APPLICABLE,,,E,BPA,S,SINGLE AWARD,RISK MANAGEMENT SUPPORT SERVICES,NONE,NONE,,,X,NOT APPLICABLE EXEMPT FROM CAS,N,TRANSACTION DOES NOT USE GFE/GFP,,,X,NO,D,NOT CONSOLIDATED,N,NO - SERVICE WHERE PBA IS NOT USED.,,,,,N,NO,X,NOT APPLICABLE,f,f,f,f,f,f,f,f,f,f,f,f,f,f,f,f,f,f,f,OTHER THAN SMALL BUSINESS,O,f,f,f,f,f,f,f,f,f,f,f,f,f,f,f,f,f,PARTNERSHIP,f,f,t,f,f,f,f,f,f,f,f,f,f,f,f,f,f,t,f,f,f,f,f,f,f,f,f,f,t,f,f,f,f,f,f,f,f,f,f,f,f,f,f,f,f,f,f,f,f,f,,,,,,,,,,,https://www.usaspending.gov/award/CONT_AWD_75N98024F00001_7529_75N98021A00089_7529/,2023-10-17,2024-09-10
